{"tannen":"divergence/1","item":"i-001","input":"sha256:aaaaaaaaaaaaaaaaaaaaaaaaaaaaaaaaaaaaaaaaaaaaaaaaaaaaaaaaaaaaaaaa","tannen_output":"sha256:bbbbbbbbbbbbbbbbbbbbbbbbbbbbbbbbbbbbbbbbbbbbbbbbbbbbbbbbbbbbbbbb","production_output":"sha256:cccccccccccccccccccccccccccccccccccccccccccccccccccccccccccccccc","offset":17,"classification":"unanalysed","analysis":"","evidence":[]}
