{"tannen":"divergence/1","item":"i-001","input":"sha256:aaaaaaaaaaaaaaaaaaaaaaaaaaaaaaaaaaaaaaaaaaaaaaaaaaaaaaaaaaaaaaaa","tannen_output":"sha256:bbbbbbbbbbbbbbbbbbbbbbbbbbbbbbbbbbbbbbbbbbbbbbbbbbbbbbbbbbbbbbbb","production_output":"sha256:cccccccccccccccccccccccccccccccccccccccccccccccccccccccccccccccc","offset":0,"classification":"production-defect","analysis":"production drops the trailing row when the export page is full","evidence":["sha256:dddddddddddddddddddddddddddddddddddddddddddddddddddddddddddddddd"]}
