{"tannen":"divergence/1","item":"i-001","input":"sha256:aaaaaaaaaaaaaaaaaaaaaaaaaaaaaaaaaaaaaaaaaaaaaaaaaaaaaaaaaaaaaaaa","tannen_output":"sha256:bbbbbbbbbbbbbbbbbbbbbbbbbbbbbbbbbbbbbbbbbbbbbbbbbbbbbbbbbbbbbbbb","production_output":"sha256:cccccccccccccccccccccccccccccccccccccccccccccccccccccccccccccccc","offset":4096,"classification":"tannen-defect","analysis":"decode layer orders repeated keys differently","evidence":[]}
