{"tannen":"divergence/1","item":"i-001","input":"sha256:aaaaaaaaaaaaaaaaaaaaaaaaaaaaaaaaaaaaaaaaaaaaaaaaaaaaaaaaaaaaaaaa","tannen_output":"sha256:bbbbbbbbbbbbbbbbbbbbbbbbbbbbbbbbbbbbbbbbbbbbbbbbbbbbbbbbbbbbbbbb","production_output":"sha256:cccccccccccccccccccccccccccccccccccccccccccccccccccccccccccccccc","offset":3,"classification":"specification-gap","analysis":"no rule says how an empty group encodes","evidence":[]}
